{
  "algorithm": "sha256",
  "files": {
    "assessment-plan.json": "e7b07824fbc3595a5bafa10d7522960b526609f0e0d31ae8956e5b301ac0cbad",
    "assessment-results.json": "e24e64a15bfc767ae620a92547466aeb9be9267e16e04bd1c791bdd9fbc3a5a0",
    "run.json": "8a87ea36e9ebd9bf446b75e5acb3420bd39872afd2b88615c547afa3fe658262"
  },
  "run_id": "20260929T120000Z",
  "schema_version": "1.0.0"
}
